{
  "default_policy": {
    "rationale": "Midnight is the v0.1 default; the alternative remains an explicit input.",
    "selected_lineage": "ziping-calculation-baseline",
    "user_disclosure_required": true
  },
  "dispute_id": "DSP-BAZI-DAY-BOUNDARY-001",
  "positions": [
    {
      "lineage": "ziping-calculation-baseline",
      "rule_ids": [
        "BAZI-CAL-DAY-001"
      ],
      "sources": [
        {
          "locator": "Pinned v1.4.8 public API and implementation",
          "source_id": "SRC-BAZI-LUNARPY-001"
        }
      ],
      "summary": "Keep the civil date's day pillar through 23:59."
    },
    {
      "lineage": "late-zi-alternative",
      "rule_ids": [
        "BAZI-CAL-DAY-002"
      ],
      "sources": [
        {
          "locator": "Pinned v1.4.8 public API and implementation",
          "source_id": "SRC-BAZI-LUNARPY-001"
        }
      ],
      "summary": "Advance the day pillar at the beginning of the Zi double-hour."
    }
  ],
  "sources": [
    {
      "locator": "Pinned v1.4.8 public API and implementation",
      "source_id": "SRC-BAZI-LUNARPY-001"
    },
    {
      "locator": "Pinned v1.4.8 public API and implementation",
      "source_id": "SRC-BAZI-LUNARPY-001"
    }
  ],
  "status": "resolved_for_product",
  "system": "bazi",
  "title": "Day pillar changes at midnight or at 23:00",
  "topic": "day boundary",
  "user_disclosure": "The default day pillar changes at midnight; select zi_initial to change it at 23:00."
}
